{
    "core":{
        "loglevel": "DEBUG",
        "default_fmt": "data/{date}/#{counter}_{name}_{time}"
    },
    "gui" :{
        "notebook": true,
        "plotlib": "matplotlib"
    },
    "fridgeserver": {
        "wsport": 8765,
        "wsenableport": 8766,
        "wsserver": "ws://localhost",
        "httpport": 8000,
        "wssendinterval": 1.0,
        "wsconnectinterval": 10.0,
        "tritonaddress": "localhost",
        "usemocktriton": false,
        "tritonname": "Triton"
    },
    "user": {}
}
